{
  "case_type": "典籍判定",
  "id": "韦千里·吴佩孚",
  "birth": {
    "year": 1874,
    "month": 4,
    "day": 21,
    "hour": 0,
    "minute": 0,
    "gender": "male",
    "time_source": "典籍反推",
    "note": "书无生辰行,由四柱「甲戌 戊辰 戊申 壬子」反推得 1874-04-21 子时(早子;史载生日 4-22,子时跨界所致,取能复现书中四柱的输入)。run-chart 复现 ✅"
  },
  "classic": {
    "源": "韦千里《批命104例》应运篇(素材/批命104例 (韦千里)….pdf, 义心论坛整理电子本) · 吴佩孚命造",
    "原文四柱": "甲戌 戊辰 戊申 壬子",
    "断语摘录": "视其戊土日元。比肩重叠。……时干透壬。乃身财两美。旺财生年头甲木之杀。惟乏火印以化杀，及金星制杀之为病。……因是益信杀重之命，最贵乎化与制矣。",
    "韦氏判定": {
      "定格": "杀重之命,贵乎制化",
      "旺衰": "身财两美(身旺)",
      "病": "乏火印化杀、乏金制杀",
      "用": [
        "金(食伤,制杀)",
        "火(印,化杀)"
      ],
      "应期要点": [
        {
          "运": "酉",
          "断": "流年不济,备尝挫扼"
        },
        {
          "运": "甲",
          "断": "最危,幸在野养晦"
        },
        {
          "运": "戌",
          "断": "比肩辅翼,蔗境安康"
        }
      ]
    }
  },
  "events": [],
  "facts": {
    "yongshen": "韦氏金标:金制杀+火化杀并举——算法层(身旺取金水木忌火土)金一侧同、火一侧相左,部分一致"
  }
}
