{
  "case_type": "典籍判定",
  "id": "韦千里·阮玲玉",
  "birth": {
    "year": 1910,
    "month": 6,
    "day": 3,
    "hour": 22,
    "minute": 0,
    "gender": "female",
    "time_source": "典籍反推",
    "note": "书无生辰行,由四柱「庚戌 辛巳 己亥 乙亥」在庚戌年巳月窗口内逐日反推得 1910-06-03 亥时,唯一解。史载阮玲玉生日 1910-04-26 属辰月,与书载巳月四柱不合(类宋子文例,书载四柱与史载生日有异),入库以书载四柱为准。run-chart 复现书中四柱 ✅"
  },
  "classic": {
    "源": "韦千里《批命104例》应运篇(素材/批命104例 (韦千里)….pdf, 义心论坛整理电子本) · 阮玲玉(1935 年身故后友人郑君嘱推)",
    "原文四柱": "庚戌 辛巳 己亥 乙亥",
    "断语摘录": "己生巳月，因有两亥，印绶冲散。时透乙木，因有庚辛，制杀太过。身主与七杀，一无可恃。故意志不坚，正途岐趋，莫之辨别，片念厄塞，死于非命。虽从两夫，终无所归。至于伤食并露，秀气发越，固宜英敏艳丽，精艺绝伦，不为银坛领袖，当亦作歌裙舞扇之翘楚也。今年两乙三亥，天干金木之战，地支水火之冲，乃满盘鼎沸，祸起萧墙，失足成恨，一代艺人，竟埋黄土。",
    "韦氏判定": {
      "旺衰": "身弱(印绶被两亥冲散,身主无可恃)",
      "病": "印绶冲散;庚辛制杀太过,杀亦无可恃(身杀两伤)",
      "用": [
        "无可恃之局(印被冲、杀被制过,身杀双弱)"
      ],
      "忌": [
        "流年再引金木之战、水火之冲"
      ],
      "应期要点": [
        {
          "年": "乙亥(1935)",
          "断": "两乙三亥,天干金木之战,地支水火之冲,满盘鼎沸,失足成恨——果于是年三月自尽"
        }
      ]
    }
  },
  "events": [],
  "facts": {
    "yongshen": "韦氏金标:印被冲散、杀被制过,身杀俱无可恃为病——女命身弱例,乙亥流年死期已验(卒于1935-03-08)"
  }
}
