{
  "case_type": "典籍判定",
  "id": "韦千里·某军人",
  "birth": {
    "year": 1903,
    "month": 9,
    "day": 24,
    "hour": 10,
    "minute": 0,
    "gender": "male",
    "time_source": "典籍反推",
    "note": "书无生辰行(佚名军人,癸酉暮春访韦氏),由四柱「癸卯 辛酉 乙卯 辛巳」在癸卯年酉月窗口内逐日反推得 1903-09-24 巳时,唯一解;癸酉(1933)年 31 岁正交戊午运午字,与断语「本年即交午火运」吻合。run-chart 复现书中四柱 ✅"
  },
  "classic": {
    "源": "韦千里《批命104例》应运篇(素材/批命104例 (韦千里)….pdf, 义心论坛整理电子本) · 某军人之命(癸酉暮春来询,三年后复临申谢,断验)",
    "原文四柱": "癸卯 辛酉 乙卯 辛巳",
    "断语摘录": "乙木死于秋，患辛金根深，受克太重。幸有癸水之泄金生木，危而有救。惟丙丁不透干，七杀不获其制，日主则不免如滴天髓所谓怀丁抱丙、跨凤乘猴，而仍嫌柔弱，为美中不足也。前运一派土金，助杀坏印，故丰才啬遇，莫展经猷。然本年即交午火运，制杀功深，定见转机。如南方有故旧，前往求授，正可水鱼胶漆，相得益彰。……此后丁巳丙三运，更较昌盛，勉以鹏程无限。",
    "韦氏判定": {
      "旺衰": "身弱(乙木死于秋,受克太重,仍嫌柔弱)",
      "病": "辛金七杀根深,受克太重;丙丁不透,七杀不获其制",
      "用": [
        "癸水印(泄金生木,危而有救)"
      ],
      "喜": [
        "火(制杀;南方为宜)"
      ],
      "忌": [
        "土金(助杀坏印)"
      ],
      "应期要点": [
        {
          "运": "前运土金(庚申、己未、戊)",
          "断": "助杀坏印,丰才啬遇,莫展经猷"
        },
        {
          "运": "午(癸酉年本年即交)",
          "断": "制杀功深,定见转机——三年后果获军长赏识,揽重权于南粤,断验"
        },
        {
          "运": "丁、巳、丙(三运)",
          "断": "更较昌盛"
        }
      ]
    }
  },
  "events": [],
  "facts": {
    "yongshen": "韦氏金标:杀重身弱,用癸印化杀、喜火制杀,忌土金助杀坏印——身弱杀格主题例,午运转机之断三年后当面验证"
  }
}
