{
  "case_type": "典籍判定",
  "id": "韦千里·虞洽卿",
  "birth": {
    "year": 1867,
    "month": 6,
    "day": 19,
    "hour": 6,
    "minute": 0,
    "gender": "male",
    "time_source": "典籍反推",
    "note": "书无生辰行,由四柱「丁卯 丙午 庚午 己卯」在丁卯年午月窗口内逐日反推得 1867-06-19 卯时,唯一解;与史载虞洽卿生日(1867-06-19,同治六年五月十七)一致。run-chart 复现书中四柱 ✅"
  },
  "classic": {
    "源": "韦千里《批命104例》应运篇(素材/批命104例 (韦千里)….pdf, 义心论坛整理电子本) · 虞洽卿先生",
    "原文四柱": "丁卯 丙午 庚午 己卯",
    "断语摘录": "识者咸云官杀混杂，财官过强为疑。窃以庚生午月，干透丁己，为纯粹正官正印之格，杀之混官，是无伤害。木火虽盛，妙有己土之泄火生身，弱中有气，全得力于时上正印。宜其温良恭俭，建树嵫基，昭然为江左闻人。惟火旺无水，似嫌亢炎，故名高利淡，积劳寡逸。早年多木火运，备尝困厄。壬运以来，一路金水，兼以所经营者多金水商业，更宜如月之恒。刻在己运，仍其旧贯。七十岁之亥运，蔗境余甘。再后戊运康强逢吉，丰厚境遇不让于前。戌运化火，明哲保身，享受考终而已。",
    "韦氏判定": {
      "旺衰": "身弱(木火盛,弱中有气)",
      "定格": "正官正印格(杀混官无伤害)",
      "病": "火旺无水,亢炎",
      "用": [
        "己土正印(泄火生身,全得力于时上正印)"
      ],
      "喜": [
        "金水(壬运以来一路金水更宜)"
      ],
      "应期要点": [
        {
          "运": "早年木火",
          "断": "备尝困厄"
        },
        {
          "运": "壬以来(一路金水)",
          "断": "更宜如月之恒"
        },
        {
          "运": "亥(七十岁)",
          "断": "蔗境余甘"
        },
        {
          "运": "戊",
          "断": "康强逢吉,丰厚不让于前"
        },
        {
          "运": "戌(化火)",
          "断": "明哲保身,享受考终"
        }
      ]
    }
  },
  "events": [],
  "facts": {
    "yongshen": "韦氏金标:官杀重身弱,官印相生取时上己土正印为用,喜金水济亢炎——身弱官杀重用印例,与阎锡山印化杀同题"
  }
}
