{
  "case_type": "典籍判定",
  "id": "韦千里·蒋邦彦",
  "birth": {
    "year": 1880,
    "month": 3,
    "day": 14,
    "hour": 2,
    "minute": 0,
    "gender": "male",
    "time_source": "典籍反推",
    "note": "书无生辰行,由四柱「庚辰 己卯 壬寅 辛丑」在庚辰年卯月窗口内逐日反推得 1880-03-14 丑时,唯一解;蒋邦彦(前浙江财政厅长)无广传史载生日可证,以书载四柱为准。run-chart 复现书中四柱 ✅"
  },
  "classic": {
    "源": "韦千里《批命104例》应运篇(素材/批命104例 (韦千里)….pdf, 义心论坛整理电子本) · 蒋邦彦先生(随张宗昌服官鲁垣,戊辰年甲子月被宗昌遣人潜杀于日本寓邸)",
    "原文四柱": "庚辰 己卯 壬寅 辛丑",
    "断语摘录": "夫壬日春生，寅卯辰会起木局，木多水缩为患，自取庚金为用，赖其生水制木也。以言格局，乃伤官用印耳。春金废而无力，万不可逢火，幸不见财星，印无伤害。天干己庚辛壬，地支丑寅卯辰，金水木联珠一气，精神饱满，皆为贵征，显赫一时，固所宜焉。壬运比肩帮身，故为发轫之始。以后仅午运稍逊。癸未运坏印。甲运敌庚，戊辰年本为七杀助印，乃慑于运君甲木之故，虽幸而越过，至甲子月，终于杀身惨毙。可见命有前定，不可挽也。",
    "韦氏判定": {
      "旺衰": "身弱(寅卯辰会木局,木多水缩为患)",
      "定格": "伤官用印",
      "病": "木多水缩(伤官泄身太过)",
      "用": [
        "庚金印(生水制木)"
      ],
      "忌": [
        "火(春金废而无力,万不可逢火)",
        "财星(坏印)",
        "甲木(敌庚)"
      ],
      "应期要点": [
        {
          "运": "壬(比肩帮身)",
          "断": "发轫之始(入仕版,历膺浙江财政厅长)"
        },
        {
          "运": "癸未",
          "断": "坏印"
        },
        {
          "运": "甲(敌庚)",
          "年": "戊辰(1928)甲子月",
          "断": "运君甲木敌庚,戊辰年虽幸而越过,至甲子月终于杀身惨毙——已验(1928年12月被张宗昌遣人潜杀)"
        }
      ]
    }
  },
  "events": [],
  "facts": {
    "yongshen": "韦氏金标:伤官(木)重身弱,用庚金印制伤生身,忌火与财坏印、甲运敌庚为死期——伤官佩印例,与蒋介石伤官佩印同格反相(彼身旺,此身弱),死期精确到月且已验"
  }
}
