{
  "case_type": "典籍判定",
  "id": "韦千里·许世英",
  "birth": {
    "year": 1873,
    "month": 9,
    "day": 10,
    "hour": 10,
    "minute": 0,
    "gender": "male",
    "time_source": "典籍反推",
    "note": "书无生辰行,由四柱「癸酉 辛酉 乙丑 辛巳」反推得 1873-09-10 巳时;与史载生日一致。run-chart 复现 ✅"
  },
  "classic": {
    "源": "韦千里《批命104例》应运篇(素材/批命104例 (韦千里)….pdf, 义心论坛整理电子本) · 许世英先生",
    "原文四柱": "癸酉 辛酉 乙丑 辛巳",
    "断语摘录": "乙木凋零。支金巳酉丑。四柱纯金。识者咸以从杀格推之。不知年头癸水进气。泄金生木。乙有根原。不能从杀。应作身弱用印。以化其杀。否则中年午丁巳丙四部火运。制杀最力。为从格所大忌。乌得稳度谷关。且屡膺重任耶。",
    "韦氏判定": {
      "定格": "七杀极重而不从(从杀之辨,韦断不从)",
      "旺衰": "身弱",
      "用": [
        "水(癸印,化杀)"
      ],
      "亦吉": [
        "火运(制杀)"
      ],
      "应期要点": [
        {
          "运": "午丁巳丙四部火运",
          "断": "制杀最力,稳度谷关屡膺重任(从格大忌火,反证不从)"
        },
        {
          "运": "卯",
          "断": "重冲,应有不利"
        },
        {
          "运": "甲寅",
          "断": "劫财帮身,老当益壮"
        }
      ]
    }
  },
  "events": [],
  "facts": {
    "yongshen": "韦氏金标:不从、身弱用印(水)——算法层判「极弱(可能从弱)」并显式并陈从/不从分歧,共识水;结论一致且算法把韦文核心议题标成了显式分歧"
  }
}
