{
  "case_type": "典籍判定",
  "id": "韦千里·郑正秋",
  "birth": {
    "year": 1889,
    "month": 1,
    "day": 25,
    "hour": 8,
    "minute": 0,
    "gender": "male",
    "time_source": "典籍反推",
    "note": "书无生辰行,由四柱「戊子 乙丑 辛丑 壬辰」在戊子年丑月(1889年1月)窗口内逐日反推得 1889-01-25 辰时,唯一解;与史载郑正秋生日(1889-01-25)一致。run-chart 复现书中四柱 ✅"
  },
  "classic": {
    "源": "韦千里《批命104例》应运篇(素材/批命104例 (韦千里)….pdf, 义心论坛整理电子本) · 郑正秋(乙亥年身故,韦氏乘本书付梓之际特殿是篇志哀)",
    "原文四柱": "戊子 乙丑 辛丑 壬辰",
    "断语摘录": "查先生之命造，辛诞寒冬，叠逢重土盛水，既患寒湿，又兼柔弱，所以质同蒲柳，未老先凋。早年丙寅丁卯等运，东南济美，学冠群英。迨交戊辰重土，书剑飘零，风尘潦倒。巳运亦未偿宿负。巳庚两部，一火一金，方见飞腾。何期岁逢乙亥，月遇癸未，亥子丑会北方，癸水又助湿，丑未再冲动，哲人遽萎。",
    "韦氏判定": {
      "旺衰": "身弱(既患寒湿,又兼柔弱)",
      "病": "重土盛水,寒湿(土晦水盛)",
      "喜": [
        "火(东南暖局)",
        "金(帮身吐秀)"
      ],
      "忌": [
        "重土(戊辰运书剑飘零)",
        "水湿(亥子丑北方、癸水助湿)"
      ],
      "应期要点": [
        {
          "运": "丙寅、丁卯(早年)",
          "断": "东南济美,学冠群英"
        },
        {
          "运": "戊辰(重土)",
          "断": "书剑飘零,风尘潦倒"
        },
        {
          "运": "巳、庚两部(一火一金)",
          "断": "方见飞腾"
        },
        {
          "年": "乙亥年癸未月(1935年7月)",
          "断": "亥子丑会北方,癸水助湿,丑未冲动,哲人遽萎——果卒于是月"
        }
      ]
    }
  },
  "events": [],
  "facts": {
    "yongshen": "韦氏金标:寒湿柔弱,喜火暖金帮、忌重土盛水——身弱调候例,乙亥年癸未月死期精确到月且已验(卒于1935-07-16)"
  }
}
