{
  "case_type": "典籍判定",
  "id": "韦千里·蒋介石",
  "birth": {
    "year": 1887,
    "month": 10,
    "day": 31,
    "hour": 12,
    "minute": 0,
    "gender": "male",
    "time_source": "典籍反推",
    "note": "书载「光绪十三年九月十五日午时生」,农历直转公历 1887-10-31 午时;与史载生日一致。run-chart 复现书中四柱 ✅"
  },
  "classic": {
    "源": "韦千里《批命104例》应运篇(素材/批命104例 (韦千里)….pdf, 义心论坛整理电子本) · 蒋介石之命",
    "原文四柱": "丁亥 庚戌 己巳 庚午",
    "断语摘录": "庚金伤官，既得九秋余气，矧复双透干头，妙有火印制伤，天生康壮之体。三命通会所载：金神入火乡，夫以伤官佩印为用。运喜逢印，不必再见伤食。",
    "韦氏判定": {
      "定格": "伤官佩印",
      "用": [
        "火(印,制伤)"
      ],
      "忌": [
        "再见伤食(金)"
      ],
      "应期要点": [
        {
          "运": "丁未",
          "断": "火力不足,龙潜于渊"
        },
        {
          "运": "丙午",
          "断": "火候功深,风云际会"
        },
        {
          "运": "甲辰",
          "断": "伤官见官,解组归田是为上策"
        }
      ]
    }
  },
  "events": [],
  "facts": {
    "yongshen": "韦氏金标:用火印,忌伤食——与算法层扶抑线(身旺忌火取金)方向相反,S1-3 主证例"
  }
}
