{
  "case_type": "典籍判定",
  "id": "韦千里·孙传芳",
  "birth": {
    "year": 1885,
    "month": 4,
    "day": 17,
    "hour": 18,
    "minute": 0,
    "gender": "male",
    "time_source": "典籍反推",
    "note": "书无生辰行,由四柱「乙酉 庚辰 壬寅 己酉」在乙酉年辰月窗口内逐日反推得 1885-04-17 酉时,唯一解;与史载孙传芳生日(1885-04-17)一致。run-chart 复现书中四柱 ✅"
  },
  "classic": {
    "源": "韦千里《批命104例》应运篇(素材/批命104例 (韦千里)….pdf, 义心论坛整理电子本) · 孙传芳(乙亥十月二版增刊,身故后论其命)",
    "原文四柱": "乙酉 庚辰 壬寅 己酉",
    "断语摘录": "夫壬水归库于辰，金凡三见，乙木合去，金水占优，以身强论。己土之官，助印有余，拘身不足，应弃而用寅内丙财，赖其破印，并以为表张耳。盛于丙运，用神得助也。败于子运之末，用火忌见水也。乙运以还，寂然无闻。亥运合寅夺丙，每况愈下。本年乙亥，再逢十月亥建，三亥交攻，用神溃败，杀人者终被人杀，夫复何疑。",
    "韦氏判定": {
      "旺衰": "身强(金水占优)",
      "病": "印重(金三见),官不拘身",
      "用": [
        "寅中丙火财(破印为用)"
      ],
      "忌": [
        "水(用火忌见水)",
        "合寅夺丙之地"
      ],
      "应期要点": [
        {
          "运": "丙",
          "断": "用神得助,盛"
        },
        {
          "运": "子(之末)",
          "断": "用火忌见水,败"
        },
        {
          "运": "亥(合寅夺丙)",
          "断": "每况愈下"
        },
        {
          "年": "乙亥(1935)十月亥建",
          "断": "三亥交攻,用神溃败,杀人者终被人杀——果于是年十一月被刺"
        }
      ]
    }
  },
  "events": [],
  "facts": {
    "yongshen": "韦氏金标:身强印重,弃官用寅中丙财破印,忌水——身强用财例,乙亥年十月死期精确到月且已验(1935-11-13 遇刺,时值亥月)"
  }
}
