{
  "case_type": "典籍判定",
  "id": "韦千里·商震",
  "birth": {
    "year": 1888,
    "month": 9,
    "day": 21,
    "hour": 6,
    "minute": 0,
    "gender": "male",
    "time_source": "典籍反推",
    "note": "书无生辰行,由四柱「戊子 辛酉 乙未 己卯」在戊子年酉月窗口内逐日反推得 1888-09-21 卯时,唯一解;与史载商震生日(1888-09-21)一致。run-chart 复现书中四柱 ✅"
  },
  "classic": {
    "源": "韦千里《批命104例》应运篇(素材/批命104例 (韦千里)….pdf, 义心论坛整理电子本) · 河南省政府知命子先生(所示为商震总指挥命造)",
    "原文四柱": "戊子 辛酉 乙未 己卯",
    "断语摘录": "乙生辛酉月，杀重身轻。财星之两透，尤足为病。所贵者，卯未会木局，帮身而制财，日主弱中有气。行运最喜比劫，遇印则印被财坏，不能化杀，未必尽美。此等命局，独喜乎比劫矣。丑运乃酉丑会成金局，故几濒于危。去年交来丙运，合杀最美，权爵更显，当不止为一方领袖。以后寅运继长增高。丁运虽善，以视丙寅，直如小巫。",
    "韦氏判定": {
      "旺衰": "杀重身轻(弱中有气)",
      "病": "财星两透(生杀坏印)",
      "用": [
        "比劫(卯未木局,帮身制财)"
      ],
      "忌": [
        "印被财坏不能化杀,遇印未必尽美"
      ],
      "应期要点": [
        {
          "运": "丑(乙丑,酉丑会金局)",
          "断": "几濒于危"
        },
        {
          "运": "丙(丙寅前半)",
          "断": "合杀最美,权爵更显,当不止为一方领袖"
        },
        {
          "运": "寅",
          "断": "继长增高"
        },
        {
          "运": "丁",
          "断": "虽善,以视丙寅直如小巫"
        }
      ]
    }
  },
  "events": [],
  "facts": {
    "yongshen": "韦氏金标:杀重身轻独喜比劫,财两透为病、印被财坏不能化杀——身弱杀格且明言弃印用劫,官杀主题对照例"
  }
}
