{
  "case_type": "典籍判定",
  "id": "韦千里·镇江金君",
  "birth": {
    "year": 1899,
    "month": 11,
    "day": 14,
    "hour": 8,
    "minute": 0,
    "gender": "male",
    "time_source": "典籍反推",
    "note": "书无生辰行(镇江人金君,研究子平十余年,就用神取定来询),由四柱「己亥 乙亥 丙戌 壬辰」在己亥年亥月窗口内逐日反推得 1899-11-14 辰时,唯一解。run-chart 复现书中四柱 ✅"
  },
  "classic": {
    "源": "韦千里《批命104例》应运篇(素材/批命104例 (韦千里)….pdf, 义心论坛整理电子本) · 镇江人金君之命",
    "原文四柱": "己亥 乙亥 丙戌 壬辰",
    "断语摘录": "丙生初冬，支见两亥，辰戌又冲，壬再透干，病于水多身弱。识者非用己土以制水，即用乙木以生火。殊不知己为卑湿之土，只可纳水，焉能镇水，况又毗邻乙木之虎视眈眈，更难以立足矣。乙木虽能生火，惟因水重太过，本身力量太轻，不无乘桴浮海之叹，此所以亦难为泰山之靠者。则亥中甲木，既得长生而进气，可泄水生木，中流砥柱，功自非浅，所谓用神，舍此莫属矣。早年只甲运优裕，昙花一现，余皆碌碌无奇。三十八岁之未运，四十八岁之午运，皆属火土，不难破壁而飞，脱颖而出。至于水流太过，终患远一，则风尘仆仆，南楚北燕，天涯飘走，乃命局早已生成，无可挽救耳。",
    "韦氏判定": {
      "旺衰": "身弱(病于水多)",
      "病": "水多(两亥、壬透、杀旺攻身)",
      "用": [
        "亥中甲木印(泄水生身,中流砥柱,舍此莫属)"
      ],
      "弃用辨析": [
        "己土制水——己为卑湿之土只可纳水不能镇水,又被乙木克",
        "乙木生火——水重太过,乙木力量太轻难为泰山之靠"
      ],
      "喜": [
        "火土(未午运破壁而飞)"
      ],
      "应期要点": [
        {
          "运": "甲(早年)",
          "断": "优裕,昙花一现"
        },
        {
          "运": "未(三十八岁)",
          "断": "火土,不难破壁而飞"
        },
        {
          "运": "午(四十八岁)",
          "断": "火土,脱颖而出"
        }
      ]
    }
  },
  "events": [],
  "facts": {
    "yongshen": "韦氏金标:病于水多身弱,三候选用神(己土/乙木/亥中甲木)逐一辨析后独取亥中甲木化杀生身——用神取舍论证最完整的一例,身弱杀(壬水)旺主题"
  }
}
