{
  "case_type": "典籍判定",
  "id": "韦千里·马占山",
  "birth": {
    "year": 1885,
    "month": 11,
    "day": 30,
    "hour": 0,
    "minute": 0,
    "gender": "male",
    "time_source": "典籍反推",
    "note": "书无生辰行,由四柱「乙酉 丁亥 己丑 甲子」在乙酉年亥月窗口内反推得 1885-11-30 子时(早子);与史载生日一致。run-chart 复现 ✅"
  },
  "classic": {
    "源": "韦千里《批命104例》应运篇(素材/批命104例 (韦千里)….pdf, 义心论坛整理电子本) · 黑龙江代理主席郎官普(所询为马占山将军命造)",
    "原文四柱": "乙酉 丁亥 己丑 甲子",
    "断语摘录": "己见亥子丑。病于水盛。助成寒湿。妙有丁火煦融。更喜邻于乙木。丁获资助，则驱寒有力。且水生木而木生火，财也杀也印也。生生不息。八字贵重。",
    "韦氏判定": {
      "病": "水盛(财)",
      "用": [
        "火(丁印,驱寒)"
      ],
      "喜": [
        "木(乙杀,资印)"
      ],
      "应期要点": [
        {
          "运": "未(中藏乙丁)",
          "断": "并含用神喜神,辛未年一鸣惊人"
        },
        {
          "运": "壬",
          "断": "水助湿,归诸平淡"
        },
        {
          "运": "午",
          "断": "丁火得禄,发扬蹈厉"
        }
      ]
    }
  },
  "events": [],
  "facts": {
    "yongshen": "韦氏金标:用丁火印、喜乙木杀化印——与算法层(身弱扶抑火土/调候丙甲戊/共识火)一致"
  }
}
