{
  "case_type": "典籍判定",
  "id": "韦千里·冼冠生",
  "birth": {
    "year": 1888,
    "month": 11,
    "day": 15,
    "hour": 4,
    "minute": 0,
    "gender": "male",
    "time_source": "典籍反推",
    "note": "书无生辰行,由四柱「戊子 癸亥 庚寅 戊寅」在戊子年亥月窗口内逐日反推得 1888-11-15 寅时,唯一解。史载冼冠生生年多作 1887(丁亥),与书载戊子年柱不合(类宋子文例),入库以书载四柱为准。run-chart 复现书中四柱 ✅"
  },
  "classic": {
    "源": "韦千里《批命104例》应运篇(素材/批命104例 (韦千里)….pdf, 义心论坛整理电子本) · 冼冠生大实业家(冠生园创办人,由薛君介绍来询)",
    "原文四柱": "戊子 癸亥 庚寅 戊寅",
    "断语摘录": "庚金生于初冬水令，地支水木林立，财重身轻，得力于时上戊土之偏印，制水帮身，功莫大焉。自必毅力胜人，思想锐敏。已往之运，泰半属火，生土而暖金，故如枯苗得雨，勃然兴之，又如疾风劲草，再接再厉。四十九岁交进戊运，帮助用神，后来居上，更可翱翔云天，卓立伟业。辰运亦有喜无尤。己运稍逊，夕阳虽好，红不多时矣。",
    "韦氏判定": {
      "旺衰": "财重身轻(初冬水令,水木林立)",
      "病": "水木财伤两旺泄克弱金",
      "用": [
        "戊土偏印(制水帮身)"
      ],
      "喜": [
        "火(生土暖金)"
      ],
      "应期要点": [
        {
          "运": "已往火运(丙寅、丁卯等)",
          "断": "生土暖金,枯苗得雨,勃然兴之"
        },
        {
          "运": "戊(四十九岁交进)",
          "断": "帮助用神,后来居上,卓立伟业"
        },
        {
          "运": "辰",
          "断": "有喜无尤"
        },
        {
          "运": "己",
          "断": "稍逊,夕阳虽好红不多时"
        }
      ]
    }
  },
  "events": [],
  "facts": {
    "yongshen": "韦氏金标:财重身轻用时上戊土偏印制水帮身,喜火生土暖金——身弱用印例,与马占山「病于水盛用丁火」同题异构(彼用印驱寒,此用印制水)"
  }
}
