{
  "case_type": "典籍判定",
  "id": "韦千里·阎锡山",
  "birth": {
    "year": 1883,
    "month": 10,
    "day": 8,
    "hour": 22,
    "minute": 0,
    "gender": "male",
    "time_source": "典籍反推",
    "note": "书载「光绪九年九月初八日亥时生」,农历直转公历 1883-10-08 亥时;与史载生日一致。run-chart 复现书中四柱 ✅"
  },
  "classic": {
    "源": "韦千里《批命104例》应运篇(素材/批命104例 (韦千里)….pdf, 义心论坛整理电子本) · 阎锡山命造",
    "原文四柱": "癸未 辛酉 乙酉 丁亥",
    "断语摘录": "秋木凋零。秋金既得其时，又得其禄。杀重身轻。……幸有癸印生身，并化杀，又有丁火食神以制杀，制化之功。乃完备矣。",
    "韦氏判定": {
      "定格": "七杀重,制化两全",
      "旺衰": "杀重身轻(身弱)",
      "用": [
        "水(癸印,生身化杀)",
        "火(丁食神,制杀)"
      ],
      "应期要点": [
        {
          "运": "午丁二运",
          "断": "春风和煦,水波不兴(水化杀火制杀之效)"
        },
        {
          "运": "巳",
          "断": "冲亥,瑕瑜互见"
        },
        {
          "运": "丙(丙子丁丑年)",
          "断": "盛极一时"
        }
      ]
    }
  },
  "events": [],
  "facts": {
    "yongshen": "韦氏金标:癸印+丁食——与算法层(扶抑水木/调候癸丁丙/格局七杀取火水/共识水)高度一致"
  }
}
