{
  "case_type": "典籍判定",
  "id": "韦千里·袁克文",
  "birth": {
    "year": 1890,
    "month": 8,
    "day": 31,
    "hour": 20,
    "minute": 0,
    "gender": "male",
    "time_source": "典籍反推",
    "note": "书无生辰行,由四柱「庚寅 甲申 甲申 甲戌」在庚寅年申月窗口内逐日反推得 1890-08-31 戌时,唯一解;与史载袁克文(袁寒云)庚寅年七月生于汉城相合。run-chart 复现书中四柱 ✅"
  },
  "classic": {
    "源": "韦千里《批命104例》应运篇(素材/批命104例 (韦千里)….pdf, 义心论坛整理电子本) · 袁子寒云(辛未之秋逝世,郑正秋以其年庚见询,曾答诸新闻报新园林)",
    "原文四柱": "庚寅 甲申 甲申 甲戌",
    "断语摘录": "初秋三甲，虽不得令，却得其势。庚金七杀，既旺且盛，堪谓身杀两强。惟乏火之制杀、印之化杀，大为缺点。是以豪放不羁，崛强寡合，虽燕许文章，机云才藻，未获显贵，抑郁以终。行运仅丙戌丁亥之二十年，较为优良，名山事业，以此最宜。再后即梦幻泡影矣。辛未流年，官之混杀，又甲木入墓，纵不至修文道山，亦有勃然他变。",
    "韦氏判定": {
      "旺衰": "身杀两强(三甲得势,七杀旺盛)",
      "病": "乏火之制杀、乏印之化杀",
      "用": [
        "火(食伤制杀,丙戌丁亥火运最宜)"
      ],
      "忌": [
        "官混杀",
        "甲木入墓之年"
      ],
      "应期要点": [
        {
          "运": "丙戌、丁亥(二十年)",
          "断": "较为优良,名山事业以此最宜;再后即梦幻泡影"
        },
        {
          "年": "辛未(1931)",
          "断": "官之混杀,又甲木入墓,纵不至修文道山,亦有勃然他变——果于是年逝世"
        }
      ]
    }
  },
  "events": [],
  "facts": {
    "yongshen": "韦氏金标:杀重贵制化,此造乏火制、乏印化为病,辛未年官混杀+甲入墓应死期——杀格缺制化的反面对照例,应期已验(卒于1931)"
  }
}
