{
  "case_type": "典籍判定",
  "id": "韦千里·周信芳",
  "birth": {
    "year": 1895,
    "month": 1,
    "day": 14,
    "hour": 12,
    "minute": 0,
    "gender": "male",
    "time_source": "典籍反推",
    "note": "书无生辰行,由四柱「甲午 丁丑 辛酉 甲午」在甲午年丑月(1895年1月)窗口内逐日反推得 1895-01-14 午时,唯一解;与史载周信芳生日(1895-01-14)一致。run-chart 复现书中四柱 ✅"
  },
  "classic": {
    "源": "韦千里《批命104例》应运篇(素材/批命104例 (韦千里)….pdf, 义心论坛整理电子本) · 周信芳(艺名麒麟童,书内两见同文)",
    "原文四柱": "甲午 丁丑 辛酉 甲午",
    "断语摘录": "余视其命造，财杀两强，而以日坐比禄，月得印绶为根，第日主较弱，不堪任财任杀，所以富贵非愿，弦歌寄情，仗义疏财，安贫洁己。然支中土金重重，可以帮身，是谓明病暗药。宜其一曲风传，万人击赏。再核运程，庚、辰、辛一派土金，盛名勿替。明年进巳字，三合金局，楼台更上。四十八岁后，壬午十年，侧重财杀，恐多纠纷，而宜倦飞知还矣。",
    "韦氏判定": {
      "旺衰": "财杀两强,日主较弱(不堪任财任杀)",
      "病": "财杀两强攻弱主(明病)",
      "用": [
        "土金帮身(日坐酉禄、月得丑印,支中土金重重为暗药)"
      ],
      "忌": [
        "财杀之地(侧重财杀则多纠纷)"
      ],
      "应期要点": [
        {
          "运": "庚、辰、辛(一派土金)",
          "断": "盛名勿替"
        },
        {
          "运": "巳(明年进巳字,巳酉丑三合金局)",
          "断": "楼台更上"
        },
        {
          "运": "壬午(四十八岁后十年)",
          "断": "侧重财杀,恐多纠纷,宜倦飞知还"
        }
      ]
    }
  },
  "events": [],
  "facts": {
    "yongshen": "韦氏金标:身弱财杀两强,用土金帮身(禄+印),巳运三合金局为吉应——身弱杀格、帮身线命例"
  }
}
