{
  "case_type": "典籍判定",
  "id": "韦千里·宋子文",
  "birth": {
    "year": 1894,
    "month": 11,
    "day": 14,
    "hour": 6,
    "minute": 0,
    "gender": "male",
    "time_source": "典籍反推",
    "note": "书无生辰行,由四柱「甲午 乙亥 庚申 己卯」反推得 1894-11-14 卯时。史载生日 12-04 与此不合,且书末自注「一说宋命为甲午乙亥庚辰己卯。未知孰是」——本例以韦所批主版本四柱为准。run-chart 复现 ✅"
  },
  "classic": {
    "源": "韦千里《批命104例》应运篇(素材/批命104例 (韦千里)….pdf, 义心论坛整理电子本) · 宋子文",
    "原文四柱": "甲午 乙亥 庚申 己卯",
    "断语摘录": "财旺身弱，幸日主坐禄。……其干神皆得旺气（庚禄在申，己禄在午，乙禄在卯，甲长生在亥）斯乃可贵。……盖日主较弱，戊寅己三运，偏重于帮身之故。未来之卯运，财愈重身愈轻，固宜韬光养晦。",
    "韦氏判定": {
      "旺衰": "财旺身弱",
      "用": [
        "帮身(土印金比)"
      ],
      "忌": [
        "财愈重(木)"
      ],
      "应期要点": [
        {
          "运": "戊寅己",
          "断": "偏重帮身,利禄功名与日俱进"
        },
        {
          "运": "寅运辛未年",
          "断": "亥卯未会木局,财重印伤"
        },
        {
          "运": "卯",
          "断": "财愈重身愈轻,宜韬光养晦"
        }
      ],
      "备注": "书载异文:「一说宋命为甲午乙亥庚辰己卯。未知孰是。」"
    }
  },
  "events": [],
  "facts": {
    "yongshen": "韦氏金标:帮身(印比)——算法层扶抑线(土金)一致,但出口.开运用神取了发用线的水,出口相左,S1-3 相关例"
  }
}
