{
  "case_type": "典籍判定",
  "id": "韦千里·杨宇霆",
  "birth": {
    "year": 1885,
    "month": 8,
    "day": 29,
    "hour": 20,
    "minute": 0,
    "gender": "male",
    "time_source": "典籍反推",
    "note": "书载四柱「乙酉 甲申 丙辰 戊戌」(见钱新之篇内附论),在乙酉年申月窗口内逐日反推得 1885-08-29 戌时,唯一解;与史载杨宇霆生日(1885-08-29)一致。run-chart 复现书中四柱 ✅"
  },
  "classic": {
    "源": "韦千里《批命104例》应运篇(素材/批命104例 (韦千里)….pdf, 义心论坛整理电子本) · 金融界巨擘钱新之先生篇内附论杨宇霆命造(钱杨二命仅差一时)",
    "原文四柱": "乙酉 甲申 丙辰 戊戌",
    "断语摘录": "按杨宇霆命为乙酉甲申丙辰戊戌，重土重金，且戊土司令，未免晦火太甚，仅赖甲乙印绶之制土帮身。巳运乃得禄，所以声势最盛，轰烈可畏。庚运无险，而毙于辰运戊辰年，则以庚运尽属木火流年，故仍炙手可热。辰运为湿土，戊辰年土又如崩，晦火无光，不得善终，意中事耳。",
    "韦氏判定": {
      "旺衰": "身弱(重土重金,戊土司令,晦火太甚)",
      "病": "重土晦火,重金泄土克木",
      "用": [
        "甲乙印绶(制土帮身)"
      ],
      "忌": [
        "湿土(晦火)"
      ],
      "应期要点": [
        {
          "运": "巳(丙火得禄)",
          "断": "声势最盛,轰烈可畏"
        },
        {
          "运": "庚(尽属木火流年)",
          "断": "无险,仍炙手可热"
        },
        {
          "运": "辰(湿土)",
          "年": "戊辰(1928-29)",
          "断": "土又如崩,晦火无光,不得善终——果于戊辰年岁末(1929年1月)被杀"
        }
      ]
    }
  },
  "events": [],
  "facts": {
    "yongshen": "韦氏金标:重土重金晦火太甚,用甲乙印制土帮身,忌湿土——身弱用印例,辰运戊辰年死期已验(1929-01-10 老虎厅事件,仍属戊辰年)"
  }
}
