{
  "case_type": "典籍判定",
  "id": "韦千里·梅兰芳",
  "birth": {
    "year": 1894,
    "month": 10,
    "day": 22,
    "hour": 6,
    "minute": 0,
    "gender": "male",
    "time_source": "典籍反推",
    "note": "书无生辰行,由四柱「甲午 甲戌 丁酉 癸卯」反推得 1894-10-22 卯时;与史载生日一致。run-chart 复现 ✅"
  },
  "classic": {
    "源": "韦千里《批命104例》应运篇(素材/批命104例 (韦千里)….pdf, 义心论坛整理电子本) · 梅兰芳先生",
    "原文四柱": "甲午 甲戌 丁酉 癸卯",
    "断语摘录": "全局木火太旺。喜日坐酉金。时得癸水。财杀清粹。兼带贵人文昌。自宜艺术独精。誉满天下。",
    "韦氏判定": {
      "旺衰": "木火太旺(身强)",
      "用": [
        "金(酉财)",
        "水(癸杀)"
      ],
      "应期要点": [
        {
          "运": "庚",
          "断": "资杀,变化飞腾未可限量"
        },
        {
          "年": "乙亥(1935)",
          "断": "印得长生杀得旺地,赴苏俄演剧必一番轰烈"
        }
      ]
    }
  },
  "events": [],
  "facts": {
    "yongshen": "韦氏金标:金水(财杀)——算法层共识木金:金一侧同,水未进主线;旺衰判定相左(韦:木火太旺 vs 算法:中和-0.1),部分一致"
  }
}
