{
  "case_type": "典籍判定",
  "id": "韦千里·李国杰",
  "birth": {
    "year": 1882,
    "month": 1,
    "day": 21,
    "hour": 10,
    "minute": 0,
    "gender": "male",
    "time_source": "典籍反推",
    "note": "书无生辰行,由四柱「辛巳 辛丑 庚申 辛巳」在辛巳年丑月(1882年1月)窗口内逐日反推得 1882-01-21 巳时,唯一解;与史载李国杰(李鸿章长孙)生于辛巳年(1881-82)相合。run-chart 复现书中四柱 ✅"
  },
  "classic": {
    "源": "韦千里《批命104例》应运篇(素材/批命104例 (韦千里)….pdf, 义心论坛整理电子本) · 李国杰先生(轮船招商局董事长)",
    "原文四柱": "辛巳 辛丑 庚申 辛巳",
    "断语摘录": "干上庚辛西方一气，支下巳为金之长生，丑为金之库门，申为金之禄地，乃属一行得气。时在季冬，金寒而失令，则较逊色。故用巳内丙火，以炼其锐，以驱其寒。前行丙丁运，富裕显赫。申运壬申年，因招商局案而入狱，良以岁运皆申，丙火用神临于病地，又受壬水之克，一时蠖屈，所不免耳。书云：丙临申位逢阳水，难获延年。其不遭夭亡，已属万幸矣。未来之乙木运，丙子丁丑两火年，东南并行，剥极必复，大器堪期于晚也。",
    "韦氏判定": {
      "旺衰": "身极旺(一行得气,庚辛西方一气)而金寒失令",
      "病": "金寒失令(季冬)",
      "用": [
        "巳中丙火(炼其锐,驱其寒)"
      ],
      "忌": [
        "申(用神病地)",
        "壬水(克丙)"
      ],
      "应期要点": [
        {
          "运": "丙、丁(前行)",
          "断": "富裕显赫"
        },
        {
          "运": "申",
          "年": "壬申(1932)",
          "断": "岁运皆申,丙火用神临病地又受壬克,因招商局案入狱——已验"
        },
        {
          "运": "乙",
          "年": "丙子、丁丑(1936-37)",
          "断": "两火年东南并行,剥极必复,大器堪期于晚"
        }
      ]
    }
  },
  "events": [],
  "facts": {
    "yongshen": "韦氏金标:一行得气(金旺之极)不以旺论忌,反用巳中丙火官杀炼金驱寒,忌申与壬水——旺极用官杀例,壬申年(1932)入狱应期已验"
  }
}
