{
  "case_type": "典籍判定",
  "id": "韦千里·顾维钧",
  "birth": {
    "year": 1888,
    "month": 1,
    "day": 29,
    "hour": 8,
    "minute": 0,
    "gender": "male",
    "time_source": "典籍反推",
    "note": "书无生辰行,由四柱「丁亥 癸丑 己亥 戊辰」在丁亥年丑月(1888年1月)窗口内逐日反推得 1888-01-29 辰时,唯一解;与史载顾维钧生日(1888-01-29,光绪十三年十二月十七)一致。run-chart 复现书中四柱 ✅"
  },
  "classic": {
    "源": "韦千里《批命104例》应运篇(素材/批命104例 (韦千里)….pdf, 义心论坛整理电子本) · 顾维钧(传闻近代伟人以顾维钧为最富)",
    "原文四柱": "丁亥 癸丑 己亥 戊辰",
    "断语摘录": "盖己生丑月，干透癸水，支见两亥，辰又为蓄水之库，财旺极矣。全得力于时上戊土之镇水帮身，用神应即归诸戊土劫财。良以无戊则安可任财，不任财则安得豪富。或取丑中辛金食神为用，恐身主更弱矣。两亥夹丑，拱子水贵人，宜其叠膺钜任，折冲坛坫，为国争光。财重用劫，内助虽得力，仍不免鼓盆兴叹，且克妻独在于戌运，是更命之可信矣。查前运多金水，花枝招展，境遇荣繁。然窃以戊运之用神得助，掌握重权，或有更进者。申运顺流而下。总之，此命逢金水火土之运，皆不为害，惟憎木之损伤用神，幸生平无木运，故三元不败，堪称得天独厚者矣。",
    "韦氏判定": {
      "旺衰": "财旺身弱(财旺极矣,取食则身主更弱)",
      "病": "水财极旺(癸透、两亥、辰库)",
      "用": [
        "戊土劫财(镇水帮身,无戊则安可任财)"
      ],
      "忌": [
        "木(损伤用神戊土)"
      ],
      "应期要点": [
        {
          "运": "戌",
          "断": "克妻独在于戌运"
        },
        {
          "运": "戊(四九后)",
          "断": "用神得助,掌握重权,或有更进"
        },
        {
          "运": "申",
          "断": "顺流而下"
        }
      ]
    }
  },
  "events": [],
  "facts": {
    "yongshen": "韦氏金标:财旺身弱用戊土劫财镇水,明言弃丑中辛金食神(恐身更弱),忌木——身弱用劫任财例,与宋子文财旺身弱喜帮身同题"
  }
}
