{
  "case_type": "典籍判定",
  "id": "韦千里·杨杏佛",
  "birth": {
    "year": 1893,
    "month": 4,
    "day": 5,
    "hour": 6,
    "minute": 0,
    "gender": "male",
    "time_source": "典籍反推",
    "note": "书无生辰行,由四柱「癸巳 丙辰 壬申 癸卯」在癸巳年辰月窗口内逐日反推得 1893-04-05 卯时,唯一解。史载杨杏佛生日多作 1893-05-04(日月互倒之疑),反推与史载同年近月,入库以书载四柱为准。run-chart 复现书中四柱 ✅"
  },
  "classic": {
    "源": "韦千里《批命104例》应运篇(素材/批命104例 (韦千里)….pdf, 义心论坛整理电子本) · 前中央研究院院长(总干事)杨杏佛先生",
    "原文四柱": "癸巳 丙辰 壬申 癸卯",
    "断语摘录": "考其辰月壬申日，并得生地库地，又癸水双透，身强有余。应用丙火之财，而巳为禄，卯为丙母，财有渊源。一代文豪，且为文官，固其宜也。盖命局粗静，病药停匀，身分超拔，若合符节。四十一岁交辛运，辛来合丙，流年复逢癸酉，酉更冲卯，一片汪洋，用神尽拔，故不免为人狙击。以前壬运癸亥年，亦满盘是水，乃得康庄平坦……巳亥虽冲，究轻于卯酉之冲，则益信用神之禄冲去犹可，用神之母万不可冲。",
    "韦氏判定": {
      "旺衰": "身强有余(得生地库地,癸水双透)",
      "用": [
        "丙火财(巳为其禄,卯为其母,财有渊源)"
      ],
      "忌": [
        "合去丙火(辛合丙)",
        "冲用神之母(酉冲卯)"
      ],
      "应期要点": [
        {
          "运": "壬",
          "年": "癸亥(1923)",
          "断": "满盘是水,乃得康庄平坦(巳亥之冲轻于卯酉之冲)"
        },
        {
          "运": "辛(四十一岁交)",
          "年": "癸酉(1933)",
          "断": "辛来合丙,酉更冲卯,一片汪洋,用神尽拔,不免为人狙击——果于是年六月遇刺"
        }
      ]
    }
  },
  "events": [],
  "facts": {
    "yongshen": "韦氏金标:身强用丙财,辛运癸酉年合丙冲卯即用神尽拔——身强用财例,癸酉年死期已验(1933-06-18 遇刺);「用神之禄冲去犹可,用神之母万不可冲」为韦氏引动细则"
  }
}
